정치개혁	"모든 범죄에 대한 솜방망이 처벌을 멈춰주세요. 고위급뿐만 아니라, 중산층과 서민을 위해서 사필귀정, 인과응보, 일벌백계 하여, 형량 기간을 더 강력하게 올려주십시요."	"1. 공소시효를 늘려주세요.

범죄를 저지르고 나서, 일정 기간 시간이 지났다고 해서 그 범죄를 쉽게 용납할 수 없습니다. 완전 범죄는 이 세상에 없어야 합니다.


2. 형벌을 정하는 양형 기준과 벌금을 지금보다 2배~3배로 꼭 늘려 주세요.

범죄 행위에 대한 법원의 실형 선고 기간이 너무 짧습니다. 마음 같아서는 기존 양형 기준에서 1년을 선고받았다면, 10년으로 0을 하나 더 붙여달라고 하고 싶은 심정입니다. 사기죄로 몇억 몇십억 꿀꺽하고, 피해금액 복구는 되지 않은 상태에서 고작 잠깐 들어갔다 나오면 된다는 우스개 소리는 대한민국에서 절대로 용납되어선 안됩니다. 전세계에서 가장 엄격하게 오랜 기간동안의 법정 실형 선고를 내려야 합니다. 미국 수준으로 양형 기준을 늘려주십시요. 


3. 범죄 발생 수익의 은닉. 탕진에 대한 강력한 환수 조치를 마련해주세요.

사기쳐서 벌은 수익을 탕진하거나 타인의 명의로 은닉하고, 민사 소송으로 사실상 찾을 수 없게 만들고, 형사 소송으로 고작 몇 년만 살다 나오는 일은 없어야 합니다. 민사로 피해액수 복원 해결이 안될 경우, 형사로 법정 실형 선고가 더욱 더 엄격하게 추가로 적용되어야 합니다. 고의적인 사기 사건을 포함하여, 민사와 형사를 따로 나눠서 법적인 소송을 진행하지 않고 함께 통합하여 재판을 할 수 있게 해야 합니다. 민사 소송으로 복구가 되지 않는 피해 금액. 특히나 사기 사건과 관련된 가해자가 범죄 수익을 탕진하거나 은닉한 피해 금액에 대해 복구가 되지 않으면 형사 처벌을 더 많이 반영해주셔야 합니다.


4. 형사사건 쌍방간의 합의로 고소 사건 진행을 멈추지 말고, 재판은 별개로 진행해주세요.

재판이 진행되도 중간에 합의를 하면 소송이 중단되는점을 악용해서 범죄 가해자는 "" 법대로 해볼테면 하라 ""는 베짱을 가지고 있습니다. 피해자는 고액의 변호인을 선임해서 고소장을 써야 하고, 경찰에 고소장을 접수하고, 수개월이 지나서, 검찰에 송치되고, 또 수개월이 지나서 법원재판이 진행되고, 또 수개월이 지나서 1심 판결을 받습니다. 그리고 중간에 일부분의 피해액만 보상받는 시늉으로 합의하면, 모든게 종료되어 버립니다. 너무 많은 비용과 시간이 소요되고 피해자의 고통은 두배 세배로 늘어납니다. 피해액 일부를 합의했다고 해서, 고소 사건 조사가 종결되어선 안됩니다. 법적인 진행절차가 너무 비용이 많이 들고, 오래 걸리고, 합의로 인해 중단할 수 있는 현실에서 가해자가 너무나 떳떳해서는 안됩니다. 피해자가 고소하는 단계에서부터 가해자가 두려워해야 합니다. 피해액에 대해 합의를 해주어도 처벌은 진행되어야 합니다. 피해액에 대해 합의를 안해주면 처벌은 더욱 더 강하게 적용되어야 합니다.


5. 기소권, 재판권의 관할 업무자 인력을 늘리고 소송에서 재판까지의 총 소요 시간을 줄여주세요.

고소장 접수 이후 법원 판결까지의 기간과 비용이 피해자에게 너무 가혹합니다. 사건 발생후 오랜 시간후에 재판을 하게 되면 기억이 희미해집니다. 그 시간동안 증거 인멸의 우려가 있고, 범죄 수익 은닉과 탕진의 기회가 있으며, 도피에 대한 우려가 있습니다. 사회적 이슈가 되는 사건에 대해서는 너무나도 신속하게 수사팀이 만들어지고, 피의사실을 언론에 알려지면서 신속하고도 실시간으로 진행되지만, 대부분의 일반인들이 고소한 수많은 사건들은 담당자들의 업무량이 많아 뒷전으로 밀려있고, 최종 단계까지 너무 많은 시간이 소요됩니다. 사건에 대한 처리 속도를 빠르게 해주십시요. 소요 기간을 꼭 줄여주셔야 합니다. 비용도 많이 드는데, 시간도 오래 걸리면 어떻게 잘못을 바로 잡습니까??


6. 초범에 대한 관대 금지. 전관예우 금지. 사면 금지. 정상 참작 적용 범위 축소.

범죄자에게 전관 예우를 받을 수 있는 변호사 선임을 통해 형벌을 감형받거나, 이미 확정된 실형 기간이 추후에 축소되는것은 반대합니다. 초범이라고 해서, 음주, 정신질환등의 돌발적인 병명의 사유로, 형량이 축소되는것도 반대합니다. 재소기간 도중에 사면되는것 또한 반대합니다.


7. 소액 차용 거래 피해. 금전적 사기 사건. 인터넷 악성 댓글등에 대한 처벌 강화. 절차 간소화.

위의 내용과 중복입니다. 소액 피해자의 수는 매우 많지만, 현실적으로 법적인 소송을 하게 되면 피해금액보다 법정 소송 비용이 더 많이 들때가 많습니다. 거액의 피해자도, 그 금액에 비례하여 거액의 수임료와 승소에 대한 일정 비율의 사례금을 내야 하는 현실이 있습니다. 소송에서 이겨도, 피해금액 복원이 불가능합니다. 그래서 금전적 피해를 봐도 법적인 절차를 통해서, 피해액을 복구 할 수 있는 상황이 아닙니다. 이것은 피해자들에게 매우 비상식적이고 부당합니다. 인터넷상의 표현의 자유를 이유로, 악성 댓글에 대한 상처를 입는 분들이 너무 많습니다. 소송 비용이 들지 않도록 간소화하여 주시고, 처벌에 대한 양형 기준을 꼭 늘려주셔야 합니다.


8. 경찰 공무집행 방해죄에 대한 엄격하게 처벌해주세요.

부패나 부작용 소지가 있는 공권력의 강화가 아닙니다. 경찰에게 멱살을 잡고, 시비나 폭언. 경찰서 안에서의 난동과 행패등에 대해 관대한 법을 모두 개정해주십시요. 경찰들은 시민에게 폭행이나 모욕적인 폭언을 당했을 경우 참지 말고 적극적으로 고소하고 체포해주십시요. 시민이 치안을 담당하는 경찰을 폭행/폭언하는데도 경찰 재량껏 묵과되거나, 처벌이 가벼운 대한민국은 나라가 아닙니다. 또한 사건 무마를 위해 경찰에게 금품등의 뇌물을 제공하는 경우, 경찰이 받지 않아도, 그 뇌물 증여 정황 시도만으로도 강력하게 처벌 할 수 있게 해주세요.


9. 가짜 뉴스에 대한 피해자 대책 방안을 마련해주세요.

이것은 매우 어려운 문제입니다. 절대로 정부가 나서서 언론의 자유를 침해할수는 없습니다. 하지만 잘못된 보도로 인해 고통받는 피해자가 있다면 구제 방법도 있어야 합니다. 좀 더 현실적으로 오보에 대한 피해자의 고통을 줄일 수 있는 지혜를 발휘해주시기 바랍니다. 최소한 오보에 대한 정정 보도 비중은 꼭 늘려주셔야 합니다.


10. 교도소내 의료시설 강화. 악용금지 해주세요.

범죄자가 아프다고 해서 수감중에 외부 병원을 이용하거나, 조사, 재판 과정이 지체되어서는 안됩니다. 법원 재판 판결에 영향을 끼쳐서는 안됩니다. 악용되지 않도록 지혜를 모아주십시요.



이상입니다. 대한민국은 사기꾼 천국의 나라입니다. 전직 대통령이 무기징역이나 15년을 받고, 추징금 몇 천억이 있어도, 실상은 십년여가 지난 지금도 거의 환수가 되지 않고, 선고받은 법정 실형조차 수감 도중에 사면 받아 자유인이 되어있는 나라입니다. 그러니 이런 가벼운 처벌의 내리는 나라안에서, 권력도 없는 일반 서민 피해자들은 또 얼마나 가슴이 미어터지겠습니까?

정부든, 야당이든 여당이든, 보수든 진보든, 모두들 대한민국의 가벼운 형량이 무가운 형량으로 바꿔주십시요. ""불법을 편법처럼 잘 하는게 능력이 되어버린 대한민국을 바꿔야 합니다."" 걸리면 잠깐 교도소에 들어갔다 풀려나오면 된다는 인식은 없어야 합니다. 합의한 규칙이 잘 지켜지는 사회. 선량하게 법을 지키는 사람들이 피해를 보지 않고 보호받아야 합니다. 유전무죄 무전유죄는 없어야 합니다.

엄격한 법으로 더 많은 범죄자들이 교도소에 있게 하고 싶지 않습니다. 범죄자들의 인권을 침해할 마음도 없습니다. 무거운 형량으로 인해 더 무서운 보복과 강력 범죄가 발생하는것도 원치 않습니다. 하지만 지금처럼 턱없이 낮은, 국민적인 공감대가 없는 솜방망이 처벌 기준은 격렬하게 반대합니다. 범국민적인 여론 조사를 실시해주십시요. 그리고 국민들의 공감을 얻는 형량으로 바꿔주십시요.

초창기에는 과도기가 있겠지만, 장기적으로는 법이 무서워서 법을 어기지 말자는 범죄 예방 효과를 기대합니다. "" 범죄 방지와 예방 효과 "" 그것이 대한민국 법이 가져야 할 덕목이자, 이 청원 내용의 최종 목표입니다.

관할 업무 소관이 아니거나, 담당 부서에 전달하고 검토해보겠습니다라는 청와대의 답변을 듣기 위해 올리는것만은 아닙니다. 많은 분들이 공감해주셨으면 좋겠고, 그 절실한 바램이 입법부, 행정부, 사법부 모두에게 알려져서 변화되기를 바랍니다.

이 청원에 절실하게 동감해주시는분들께는, 본인의 SNS공유. 특히 SNS 헤비 유저나 오피니언 리더, 기자분들께도 전달해주셨으면 좋겠습니다. 피를 토하는 심정으로 간절하게 바라고 싶습니다.

 대한민국의 치안 상태는 매우 훌륭합니다. 여기에 만족하지 말아주십시요. 특히 서민을 울리는 각종 사기꾼들을 포함해서, 모든 범죄인들에게 사필귀정, 인과응보, 일벌백계 해주시고 피해받은 금액을 온전하게 돌려받을 수 있게 해주십시요. 범죄수익 은닉과 탕진으로 무의미해진 민사 소송 절차를 현실에 맞게 바꿔주십시요. 대한민국에 정의 사회 구현을 실천해주십시요."
기타	근로자만이 아닌 사업자보호법도 마련해주세요	"안녕하세요 저는 한철 일해서 1년을 살아가는 가장을 둔 아내입니다
저희신랑이 올해 개인사업자로 첫발을 내딛고 너무나 억울하고 속상한 사정에 청원을 올리게 되었습니다

사업자들은 나라에 내는 세금이 적지 않습니다
모든 사업자분들이 마찬가지지만 경기도 어렵고 힘이듭니다
신랑은 여름에만 일을 하는 에어컨설치직업인지라 그시기에 가장 바쁘고 한철 버는일이고 그한철 몇달을 부기사를 채용해서 2인1조로 해야 일할수 있는 직종입니다

혼자서는 일할수 없는데 이웃집 자녀가 일하겠다하여 채용해서 근무하던 한달반만에 갑자기 일을 안나오고 퇴사의사도 밝히지 않았습니다 그짧은기간에 실외기추락, 제품을 착오해 오설치한것, 구멍마감 잘못해 이후 고객의 클레임들어와 벽지전체 교체손해배상등의 비용등 손해가 굉장히 막심했습니다.

이웃집 아이라서 급여외에 별도로 더 챙겨준비용도 있습니다
갑자기 하루아침 퇴사의사도 없이 잠수타듯하여 한창 많이버는 시기인데 무려 1주일을 일을 못하게 되었습니다

계속 연락시도해도 통화나 카톡읽고 답장조차 없었는데 무려 4달지난 지금 그부모가 아들은 군대가고없는데 위임받았다며 급여달라고 노동부에 신고를 했습니다

그런데 법은 근로자에게만 유리하고 사용자는 별도로 손해를 입증하여 손해배상만 하라고합니다.
그렇다하여 사용자에게 그에맞는 법적인 비용이나 전문가를 지원해주는것도 아닙니다

세금한푼 안떼고 소득신고도 안되서 부가세 종합소득세 신고때 직원의 급여지급을 처리하지 않기에 세금조차 많이 내게됩니다

정작 소득세조차 내지 않는 알바의 급여를 챙겨주게되고 이쪽업계나 이런방식으로 단기알바를 써야하는 사업자들은 두번 피눈물과 배신감에 상처를 안고삽니다

4대보험 의무로 들어주려하지만 정작 단기일하는 젊은이들은 4대보험이나 소득신고를 꺼리기때문에 지원자가없어 직원을 채용하기가 어렵습니다
그렇기에 서로 암묵의 의사로서 근로계약체결하고 사용자는 세금을 더내가며 채용한 수 밖에 없습니다.

법은 만인에게 공평하여야 한다고 알고 있습니다
억울한 근로자에겐 법이 꼭 필요하지만 그와반대로 손해만 끼치고 퇴사하는 무단퇴사자들로인해 손해를본 사용자에게도 그에 합당한 지원을 해줘야합니다

더이상 무단퇴사로 인한 사용자들의 피해는 없어야할것이고 근로자만 보호하는 일방적인 법도 바뀌어야합니다

억울한 근로자들은 보호해주고 그에따라 억울한 사용자또한 보호받는 법안을 마련해주세요"
인권/성평등	"대한민국의 채용성차별을 규탄하고, 여?남 동일고용 동일임금 및 여성의무할당제을 요구합니다."	"기회는 평등할 것입니다.
과정은 공정할 것입니다.
결과는 정의로울 것입니다.
남성에게만.

   문재인 대통령님. 페미니스트 대통령이라는 선언 대단히 감명 깊었습니다. 하지만 문재인 정부 집권 3년차인 2019년에도 여성들이 체감하는 실제 삶은 전 정권들과 비교하여 큰 차이가 없습니다.  대한민국은 여전히 노동시장에서 여성들을 공공연하게 차별하고 배제하며, OECD 가입국 성별 임금격차 부동의 1위의 불명예를 자랑하고 있는 초대형 젠더갭 국가이기 때문입니다. 이처럼 여성노동자에게 동일노동 동일임금은 성립하지 못합니다. 또한 여남고용평등법 또한 유명무실합니다. 대통령님께서 이 처참한 현실을 변화시키려 노력하시는 것을 잘 알고 있지만 이번 서울 메트로가 남성만을 채용하기 위해 고득점 여성을 과락시킨 채용성차별 범죄에 한 명의 취준생으로서 큰 충격을 받아 대한민국 모든 여성을 위한 국민청원을 올립니다. 여성을 채용하지 않으려 고의적인 과락, 성별 분리 채용, 면접점수 조작과 커트라인 차등, 특별 가점을 주어 여성지원자를 탈락시킨 공기업 및 민간기업이 고작 적발된 몇몇 뿐이라 생각되지않습니다.  사회적 책무를 방기하고 공기업 에서도 버젓이 관행으로 자행되고 있었으니 말입니다. 문재인 대통령께서는 전국적으로 모든 공 ?민간기업들의 채용성차별의 위법성과 해악성을 엄중하게 인식하시고, 이전까지 기업들이 채용과 인사 과정에 어떻게 성차별을 자행해왔는지 철저한 전수조사를 실시해 주십시오. 또한 이전 성차별적 고용 불평등 사태의 채용 담당자와 모든 관련자들을 크게 처벌하고, 부당하게 탈락한 모든 여성지원자들에게 적법한 보상과 채용으로 응답해야 합니다. 이전까지 적발된 성별 고용 불평등 사례들처럼 이번에도 똑같이 솜방망이 처벌을 한다면, 젠더불평등은 지속되고 사회변화는 요원할 것입니다. 또한 비생산적인 유교 이데올로기에 기반한 가부장제 성별 통념에 기반한 노동시장 남성 과잉 편중 및 장기화된 경제침체는 여?남 동일고용 동일임금과 의무 여성할당제 시너지로 인한 국내 여성인력 활용으로 극복할 수 있습니다. 이렇듯 사회전반의 합의와 노력으로 양성평등에 도달할 때 여 ? 남 징병제 또한 자연히 시행할 수 있음을 정부와 국방부는 염두에 두어야 할 것입니다.

   2017년 방한했던 당시 IMF 총재 크리스틴 라가르드는 여성의 경제활동 확대가 한국 경제의 노동력 부족을 해결하고 성장 동력을 회복할 열쇠라고 말했습니다. “향후 5년간 한국 경제활동인구는 해마다 10만 명씩 줄어 0.2%P씩 감소할 전망” 이라며 “더 많은 여성이 일할 수 없다면 이 위기를 타파할 수 없다”고 강조했다고 합니다. 이로부터 2년 간 한국은 경기침체에 얼마나 적극적으로 대처해 왔는지 자문해 볼 일입니다.
관련기사: [라가르드 IMF 총재 “여성이 살아야 한국 경제가 산다.”]
http://www.womennews.co.kr/news/articleView.html?idxno=116900 …

더 나은 미래, 모두가 행복한 양성평등 한국을 위한 구체적인 요구사항

하나. 페미니스트 대통령 문재인은 후보자 시절 공약으로 발표한 내용을 임기 내 엄수하라.
->  채용 시 여성 불이익 막기 위한 ‘블라인드 채용제’ 도입
-> ‘동일가치노동 동일임금’ 법제화
-> 비정규직 급여를 정규직 70~80% 수준으로 상향
-> 청년고용촉진특별법을 개정해 여성 고용 확대
-> 여성 고용 우수기업에 인센티브 제공
-> 부처 별 여성정책 총괄·조정 기능 강화
-> 임금감소 없는 근로시간 단축·유연근무제 도입
-> 아동·청소년 성보호법 개정으로 친족과 장애인 성폭력 가중처벌
-> 공교육에 인권과 성평등 포함

관련기사 : [문재인 “페미니스트 대통령” 선언… 성평등 정책 청사진 제시]
https://www.womennews.co.kr/news/articleView.html?idxno=111793 …

  한국가스안전공사의 경우 성차별 채용이 문제가 되자 2018년에 70명을 채용하면서 블라인드 채용을 실시. 24명의 여성이 합격했으며 합격률은 34%였음. 이는 2013부터 2017년 까지의 평균 합격률 16%의 2.1배 수준으로 크게 증가한 것. 블라인드 채용 실시 이전에는 모든 여성지원자들이 부당하게 차별받아 탈락했음을 의미함. 블라인드 채용을 모든 공기업 채용에 적용하고, 사기업들이 공채에 이를 적용하지 않을시 패널티를 주는 방향으로 법제화할 것.


하나. 각 관공서와 공기업, 사관학교, 경찰, 기업(민간/공공기관)의 성별현원인원 의무공개와 성별 임금공시제(공표제)실시로 사전 임금공지를 의무화를 요구한다.

 1) 순경 채용 성비 5 : 5 의무화.
 (2019년 경찰공무원 모집정원 중 순경채용비율 1차 여 396 남 1041명 / 2차 여 387 남 1012 )
 -> 현재 경찰공무원 채용과정에서 성별간 모집인원 차이로 인해 여성 지원자들보다 점수가 떨어지는 남성들이 채용되고 있으며, 이는 헌법 정신에 위배되는 명백한 차별 채용이자 경찰 수준의 질적 하락을 초래하는 악습.

관련기사 : [2019년 제1차 경찰공무원(순경) 채용 필기시험 합격선]
http://www.lec.co.kr/news/articleView.html?idxno=711457

 2) 육해공사 신입생 성별정원 폐지 

 3) 공기업 및 공무원 성별 임금공시제(공표제)실시, 인터넷 무료 공개로 국민 누구나 공무원 및 공직자의 임금정보에 쉽게 접근 할 수 있도록 정보공개


하나. 유명무실한 여남고용평등법 대신 사회전반 여성 할당제 50%를 요구한다.

1) 문재인 정부 내각 구성 2020년 상반기까지 5 : 5 달성
-> 2019년 10월 현재 총원 26명 중 여성 6명 (23%)

2) 공기업 임원 공공기관장 국공립대학 교수 여성의무할당 50% 달성
-> 2020년까지 30%, 2022년까지 50% 달성 목표로
관련기사 : [공기업 35곳 여성임원 ‘단 1명’…2022년까지 20% 확대 정책 ‘빨간불’]
http://www.ceoscoredaily.com/m/m_article.html?no=51841 …

3) 국내 500대 기업 여성임원 50%할당
-> 정부에서 매년 분야별 여성임원 적정 할당비율을 제시한 뒤 위반시 패널티를 가하라
관련기사 : [작년 500대 기업 여성임원 518명...전년보다 64명 늘었다]
http://www.ceoscoredaily.com/m/m_article.html?no=5841 …

4) 국회의원 여성할당 관련 법안들 통과
-> 의안번호 2018338 정당법 일부개정법률안 (박영선 의원 대표발의), 의안번호 2018349 정치자금법 일부개정법률안, 의안번호 2018350 공직선거법 일부개정법률안

5) 국회 상임위원회 여성의원 50%할당
-> 국회상임위원회 전체의원 수 대비 50% 여성의원으로, 여가위 정원 17명중 10명 이상 여성으로, 법제 사법위원회 위원 50% 이상 여성의원으로. (현재 총 18명 중 2명)

6) 고등법원 부장판사 이상급 판사에 여성할당 50%
-> 전체 법관 2918명 중 여성 법관은 889명(30.5%) , 지방법원 부장판사는 19.7%(1150명 중 227명), 고등법원 부장판사는 4.3%(139명 중 6명), 대법관은 23.1%(13명 중 3명)
출처: 대법원 발표자료
 사법부의 극심한 남성편향은 남성범죄자들에 지나치게 관대한 형량을 선고하는 참사로 이어지고 있으며, 지속적으로 국민들의 공분을 사는 중. 최근의 아동성범죄영상 운영자 손정우 및 그 범죄에 가담한 남성범죄자들에 대한 한국 사법부의 경악스러운 판결은 국제사회에서  널리 회자되며 국가의 치욕이 되었음. 이를 해결하기 위해서는 부장판사급 이상에 성비를 조율하여 판사집단 내부의 인권감수성을 올리려는 시도를 지속적으로 하지 않는이상 자정은 어려워 보임.

관련기사 : [희대의 아동포르노···세계 경악케한 한국인 죗값]
https://news.joins.com/article/23612197

 7) 경찰 고위직 여성할당 50%

 -> '2018년도 공무원 범죄 통계 자료' 에 따르면 2018년 한 해동안 범죄를 저지른 국가공무원은 모두 3,356명 이중 경찰청 소속 공무원은 1,640명으로 전체의 48.9%로 공무원 범죄율 1위.
출처: 경찰청 발표자료

 부패와 범죄 은닉에 앞장서고 있는 경찰집단에 대대적인 개혁이 필요. 버닝썬 사건 등의 수사 때 드러난 남성경찰들의 부정부패는 이미 온국민에게 널리 알려진 사실로, 이는 젊고 청렴한 경찰들의 채용과 승진을 통해서만 개혁할 수 있음. 경찰공무원 인사운영 규칙 수정 필요.

관련기사 : [“경찰대 성별제한 폐지”…여성 청장 1호는 언제쯤 나올까요?]
http://www.hani.co.kr/arti/society/society_general/851245.html

8) 국가대표 감독과 코치에 여성할당 50%
-> 끝없는 선수들을 향한 성범죄와 폭력에 대응과 무능력한 협회의 개혁을 위해서라도, 감독과 코치의 전반적인 물갈이가 필요. 최소한 여성 팀에는 여성감독을 배치할 것.

 대한민국의 수많은 성별고용 불평등은 더 이상 남의 이야기가 아닌 우리 여성노동자의 이야기입니다. 말로만 정의와 평등을 실현하겠다고 외쳐봤자 현상유지일 뿐이며, 여성주의적 가치는 오직 실천하는 것으로 증명됩니다. 페미니스트 문재인 대통령께서는 대한민국의 유권자들의 절반인 여성들을 보호하십시오. 지금은 여성상위 시대가 아닌 더 많은 페미니즘이 필요한 시대입니다. 통계청 자료에 따르면 2018년 한국 여성의 경제활동 참여율은 52.9%에 이르고 있습니다. 여성은 이미 국가 경제의 한 축이며, 이들의 역할과 역량에 대한 정당한 평가와 보상이 없다면 차별로 누적된 분노는 폭발하고 말 것입니다. 지구상 유일의 출생률 0점대 국가라는 냉정한 현실이 이미 우리앞에 놓여있습니다. 대통령님, 이것은 청원이 아닙니다. 사실상의 최후통첩 입니다. 총성 한 번 울리지 않고 역사 속에서 사라져간 국가로 기록되지 않으려면 이 나라를 어떤 방향으로 끌어가야 할지는 자명합니다.

 이상으로 국민청원을 갈무리합니다."
안전/환경	오류동역 여고생 열차사고의 진실을 말합니다.	"저희는 그 여고생의 유가족이며,
지난 10월 19일 20시 59분경에 일어난 여고생 사망사고의 진실을 말하려고 합니다.
댓글에 오해가 많은 것 같아서 정확한 사고원인을 알려 드리고자 작성한 글입니다. 

정확한 사고원인은 사고사입니다.
사고 당시 선로에서 뛰어내린 것이 아니라 승강장 끝에서 역 선로 위를 벗어나고자 승강장으로 올라가려고 하던 중 오류동역을 통과하던 동인천행 급행열차와 부딪혀 그 자리에서 사망한 것입니다. 

우리 딸은 오류동역 승강장으로 바로 들어간 것이 아니라, 오류동역 근처를 거닐다가 오류동역과 조금 떨어진 렌트카 주차장과 화물기차 하역장의 열려있는 문을 통해 들어가서 길을 잃었고, 어두운 밤  불빛이 보이는 승강장쪽으로 되돌아오던 중 오류동역 인천행 급행열차 통과구간에서 안전한 승강장으로 올라가려다가 달려오는 급행열차를 
미처 피하지 못하고 사고로 이어진 것이 이 사고의 진실입니다.

